{
  "schemaVersion": "sapphirus.generator-qualification.v1",
  "variant": {
    "kind": "text",
    "text": ""
  },
  "nullableValue": null,
  "signedValue": 0,
  "unsignedValue": 0,
  "interoperableValue": 0,
  "externalValue": {
    "code": "ext_A1B2"
  },
  "label": "",
  "items": [],
  "node": {
    "value": "",
    "next": null
  }
}
