{
  "schemaVersion": "sapphirus.generator-qualification.v1",
  "variant": {
    "kind": "text",
    "text": "depth-eight"
  },
  "nullableValue": null,
  "signedValue": 0,
  "unsignedValue": 0,
  "interoperableValue": 0,
  "externalValue": {
    "code": "ext_D8E8"
  },
  "label": "depth-eight",
  "items": [],
  "node": {
    "value": "depth-2",
    "next": {
      "value": "depth-3",
      "next": {
        "value": "depth-4",
        "next": {
          "value": "depth-5",
          "next": {
            "value": "depth-6",
            "next": {
              "value": "depth-7",
              "next": {
                "value": "depth-8",
                "next": null
              }
            }
          }
        }
      }
    }
  }
}
